{
  "preset_name": "standard-game",
  "version": "1.0",
  "target": "AudioMixer",
  "_note": "General gameplay mix with music ducking under SFX intensity. Suitable for action, adventure, and exploration games.",
  "groups": [
    {
      "name": "Master",
      "parent": null,
      "attenuation": 0
    },
    {
      "name": "Music",
      "parent": "Master",
      "attenuation": 0
    },
    {
      "name": "SFX",
      "parent": "Master",
      "attenuation": 0
    },
    {
      "name": "UI",
      "parent": "Master",
      "attenuation": 0
    },
    {
      "name": "Voice",
      "parent": "Master",
      "attenuation": 0
    }
  ],
  "exposed_parameters": [
    {
      "name": "Master Volume",
      "controlGroup": "Master",
      "controlProperty": "Volume"
    },
    {
      "name": "Music Volume",
      "controlGroup": "Music",
      "controlProperty": "Volume"
    },
    {
      "name": "SFX Volume",
      "controlGroup": "SFX",
      "controlProperty": "Volume"
    },
    {
      "name": "UI Volume",
      "controlGroup": "UI",
      "controlProperty": "Volume"
    },
    {
      "name": "Voice Volume",
      "controlGroup": "Voice",
      "controlProperty": "Volume"
    }
  ],
  "effects": [
    {
      "group": "Master",
      "effectType": "AudioMixerEffectController",
      "effectName": "Compressor",
      "enabled": true,
      "parameters": {
        "threshold": -20,
        "ratio": 2,
        "attackTime": 0.01,
        "releaseTime": 0.5,
        "makeupGain": 0
      }
    },
    {
      "group": "Master",
      "effectType": "AudioMixerEffectController",
      "effectName": "Reverb",
      "enabled": true,
      "parameters": {
        "dryLevel": -1,
        "room": 0.2,
        "roomHF": -200,
        "decayTime": 1.5,
        "decayHFRatio": 0.5,
        "reflectionLevel": -1500,
        "reflectionDelay": 0.04,
        "reverbLevel": -10,
        "reverbDelay": 0.04
      }
    },
    {
      "group": "Music",
      "effectType": "AudioMixerEffectController",
      "effectName": "Compressor",
      "enabled": true,
      "parameters": {
        "threshold": -15,
        "ratio": 3,
        "attackTime": 0.1,
        "releaseTime": 0.3,
        "makeupGain": 0
      }
    },
    {
      "group": "SFX",
      "effectType": "AudioMixerEffectController",
      "effectName": "HighPass",
      "enabled": true,
      "parameters": {
        "cutoffFrequency": 20,
        "resonanceQ": 1
      }
    },
    {
      "group": "Voice",
      "effectType": "AudioMixerEffectController",
      "effectName": "Compressor",
      "enabled": true,
      "parameters": {
        "threshold": -18,
        "ratio": 2,
        "attackTime": 0.05,
        "releaseTime": 0.2,
        "makeupGain": 0
      }
    }
  ],
  "snapshots": [
    {
      "name": "Gameplay",
      "overrides": {
        "Master Volume": 0,
        "Music Volume": -3,
        "SFX Volume": 0,
        "UI Volume": -6,
        "Voice Volume": 0
      }
    },
    {
      "name": "Dialogue",
      "overrides": {
        "Master Volume": -6,
        "Music Volume": -12,
        "SFX Volume": -9,
        "UI Volume": -15,
        "Voice Volume": 3
      }
    },
    {
      "name": "Menu",
      "overrides": {
        "Master Volume": 0,
        "Music Volume": 0,
        "SFX Volume": -3,
        "UI Volume": 0,
        "Voice Volume": -20
      }
    }
  ]
}
